{
  "schema_version": "hibench.benchmark.v1",
  "run": {
    "schema_version": "hibench.benchmark.v1",
    "run_id": "pi-0.75.2-hi",
    "agent_id": "pi",
    "agent_version": "0.75.2",
    "run_dir": "runs/pi-0.75.2-hi",
    "agent_name": "Pi",
    "agent_image": "hibench/pi:0.75.2",
    "prompt_file": "prompts/hi.txt",
    "prompt_name": "hi",
    "started_at": "2026-06-14T08:22:55Z",
    "ended_at": "2026-06-14T08:22:57Z",
    "subject_workspace": "generated empty Git repository",
    "real_api_call": false,
    "process_exit_code": 0,
    "process_timed_out": false,
    "request_count": 1,
    "post_request_count": 1,
    "has_primary_request": true,
    "primary_request_index": 1,
    "request_method": "POST",
    "request_path": "/v1/chat/completions",
    "model": "gpt-5",
    "tokenizer_library": "tiktoken",
    "tokenizer_encoding": "o200k_base",
    "total_body_tokens": 1229,
    "body_tokens": 1229,
    "body_bytes": 5523,
    "body_chars": 5523,
    "text_field_count": 2,
    "text_tokens": 524,
    "system_prompt_tokens": 523,
    "environment_context_tokens": 0,
    "user_prompt_tokens": 1,
    "assistant_context_tokens": 0,
    "tool_context_tokens": 0,
    "other_text_tokens": 0,
    "main_instructions_tokens": 523,
    "developer_instructions_tokens": 0,
    "permissions_instructions_tokens": 0,
    "skills_instructions_tokens": 0,
    "injected_user_context_tokens": 0,
    "instruction_tokens": 523,
    "default_context_tokens": 1158,
    "skills_count": 0,
    "skills_tokens": 0,
    "skill_definition_tokens": 0,
    "tool_count": 4,
    "tool_definition_tokens": 635,
    "mcp_count": 0,
    "mcp_tokens": 0,
    "mcp_marker_count": 0,
    "mcp_mention_count": 0,
    "mcp_mention_tokens": 0,
    "subagent_count": 0,
    "subagent_tokens": 0,
    "subagent_marker_count": 0,
    "subagent_mention_count": 0,
    "subagent_mention_tokens": 0,
    "anthropic_tokenizer_model": "claude-opus-4-8",
    "anthropic_total_body_tokens": 1934
  },
  "tools": [
    {
      "schema_version": "hibench.benchmark.v1",
      "run_id": "pi-0.75.2-hi",
      "agent_id": "pi",
      "agent_version": "0.75.2",
      "request_index": 1,
      "tool_index": 1,
      "tool_name": "read",
      "tool_type": "function",
      "path": "tools.0",
      "definition_chars": 694,
      "definition_tokens": 161,
      "is_mcp_related": false,
      "is_subagent_related": false,
      "keys": "function|type"
    },
    {
      "schema_version": "hibench.benchmark.v1",
      "run_id": "pi-0.75.2-hi",
      "agent_id": "pi",
      "agent_version": "0.75.2",
      "request_index": 1,
      "tool_index": 2,
      "tool_name": "bash",
      "tool_type": "function",
      "path": "tools.1",
      "definition_chars": 557,
      "definition_tokens": 121,
      "is_mcp_related": false,
      "is_subagent_related": false,
      "keys": "function|type"
    },
    {
      "schema_version": "hibench.benchmark.v1",
      "run_id": "pi-0.75.2-hi",
      "agent_id": "pi",
      "agent_version": "0.75.2",
      "request_index": 1,
      "tool_index": 3,
      "tool_name": "edit",
      "tool_type": "function",
      "path": "tools.2",
      "definition_chars": 1252,
      "definition_tokens": 258,
      "is_mcp_related": false,
      "is_subagent_related": false,
      "keys": "function|type"
    },
    {
      "schema_version": "hibench.benchmark.v1",
      "run_id": "pi-0.75.2-hi",
      "agent_id": "pi",
      "agent_version": "0.75.2",
      "request_index": 1,
      "tool_index": 4,
      "tool_name": "write",
      "tool_type": "function",
      "path": "tools.3",
      "definition_chars": 445,
      "definition_tokens": 95,
      "is_mcp_related": false,
      "is_subagent_related": false,
      "keys": "function|type"
    }
  ],
  "mcp": [],
  "subagents": [],
  "skills": [],
  "text_fields": [
    {
      "schema_version": "hibench.benchmark.v1",
      "run_id": "pi-0.75.2-hi",
      "agent_id": "pi",
      "agent_version": "0.75.2",
      "request_index": 1,
      "text_index": 1,
      "category": "system_prompt",
      "source": "main_instructions",
      "role": "system",
      "path": "messages.0.content",
      "chars": 2347,
      "tokens": 523,
      "preview": "You are an expert coding assistant operating inside pi, a coding agent harness. You help users by reading files, executi"
    },
    {
      "schema_version": "hibench.benchmark.v1",
      "run_id": "pi-0.75.2-hi",
      "agent_id": "pi",
      "agent_version": "0.75.2",
      "request_index": 1,
      "text_index": 2,
      "category": "user_prompt",
      "source": "user_prompt",
      "role": "user",
      "path": "messages.1.content.0.text",
      "chars": 2,
      "tokens": 1,
      "preview": "Hi"
    }
  ]
}
