{
  "schema_version": "hibench.benchmark.v1",
  "run": {
    "schema_version": "hibench.benchmark.v1",
    "run_id": "codex-0.113.0-hi",
    "agent_id": "codex",
    "agent_version": "0.113.0",
    "run_dir": "runs/codex-0.113.0-hi",
    "agent_name": "OpenAI Codex CLI",
    "agent_image": "hibench/codex:0.113.0",
    "prompt_file": "prompts/hi.txt",
    "prompt_name": "hi",
    "started_at": "2026-06-13T15:04:30Z",
    "ended_at": "2026-06-13T15:04:30Z",
    "subject_workspace": "generated empty Git repository",
    "real_api_call": false,
    "process_exit_code": 0,
    "process_timed_out": false,
    "request_count": 1,
    "post_request_count": 1,
    "has_primary_request": true,
    "primary_request_index": 1,
    "request_method": "POST",
    "request_path": "/v1/responses",
    "model": "gpt-5.3-codex",
    "tokenizer_library": "tiktoken",
    "tokenizer_encoding": "o200k_base",
    "total_body_tokens": 5007,
    "body_tokens": 5007,
    "body_bytes": 22671,
    "body_chars": 22637,
    "text_field_count": 5,
    "text_tokens": 3341,
    "system_prompt_tokens": 2615,
    "environment_context_tokens": 50,
    "user_prompt_tokens": 676,
    "assistant_context_tokens": 0,
    "tool_context_tokens": 0,
    "other_text_tokens": 0,
    "main_instructions_tokens": 2551,
    "developer_instructions_tokens": 64,
    "permissions_instructions_tokens": 64,
    "skills_instructions_tokens": 0,
    "injected_user_context_tokens": 50,
    "instruction_tokens": 2665,
    "default_context_tokens": 4037,
    "skills_count": 0,
    "skills_tokens": 0,
    "skill_definition_tokens": 0,
    "tool_count": 7,
    "tool_definition_tokens": 1372,
    "mcp_count": 0,
    "mcp_tokens": 0,
    "mcp_marker_count": 0,
    "mcp_mention_count": 0,
    "mcp_mention_tokens": 0,
    "subagent_count": 0,
    "subagent_tokens": 0,
    "subagent_marker_count": 0,
    "subagent_mention_count": 0,
    "subagent_mention_tokens": 0,
    "anthropic_tokenizer_model": "claude-opus-4-8",
    "anthropic_total_body_tokens": 7823
  },
  "tools": [
    {
      "schema_version": "hibench.benchmark.v1",
      "run_id": "codex-0.113.0-hi",
      "agent_id": "codex",
      "agent_version": "0.113.0",
      "request_index": 1,
      "tool_index": 1,
      "tool_name": "exec_command",
      "tool_type": "function",
      "path": "tools.0",
      "definition_chars": 2121,
      "definition_tokens": 450,
      "is_mcp_related": false,
      "is_subagent_related": false,
      "keys": "description|name|parameters|strict|type"
    },
    {
      "schema_version": "hibench.benchmark.v1",
      "run_id": "codex-0.113.0-hi",
      "agent_id": "codex",
      "agent_version": "0.113.0",
      "request_index": 1,
      "tool_index": 2,
      "tool_name": "write_stdin",
      "tool_type": "function",
      "path": "tools.1",
      "definition_chars": 674,
      "definition_tokens": 138,
      "is_mcp_related": false,
      "is_subagent_related": false,
      "keys": "description|name|parameters|strict|type"
    },
    {
      "schema_version": "hibench.benchmark.v1",
      "run_id": "codex-0.113.0-hi",
      "agent_id": "codex",
      "agent_version": "0.113.0",
      "request_index": 1,
      "tool_index": 3,
      "tool_name": "update_plan",
      "tool_type": "function",
      "path": "tools.2",
      "definition_chars": 624,
      "definition_tokens": 143,
      "is_mcp_related": false,
      "is_subagent_related": false,
      "keys": "description|name|parameters|strict|type"
    },
    {
      "schema_version": "hibench.benchmark.v1",
      "run_id": "codex-0.113.0-hi",
      "agent_id": "codex",
      "agent_version": "0.113.0",
      "request_index": 1,
      "tool_index": 4,
      "tool_name": "request_user_input",
      "tool_type": "function",
      "path": "tools.3",
      "definition_chars": 1355,
      "definition_tokens": 289,
      "is_mcp_related": false,
      "is_subagent_related": false,
      "keys": "description|name|parameters|strict|type"
    },
    {
      "schema_version": "hibench.benchmark.v1",
      "run_id": "codex-0.113.0-hi",
      "agent_id": "codex",
      "agent_version": "0.113.0",
      "request_index": 1,
      "tool_index": 5,
      "tool_name": "apply_patch",
      "tool_type": "custom",
      "path": "tools.4",
      "definition_chars": 838,
      "definition_tokens": 251,
      "is_mcp_related": false,
      "is_subagent_related": false,
      "keys": "description|format|name|type"
    },
    {
      "schema_version": "hibench.benchmark.v1",
      "run_id": "codex-0.113.0-hi",
      "agent_id": "codex",
      "agent_version": "0.113.0",
      "request_index": 1,
      "tool_index": 6,
      "tool_name": "web_search",
      "tool_type": "web_search",
      "path": "tools.5",
      "definition_chars": 49,
      "definition_tokens": 12,
      "is_mcp_related": false,
      "is_subagent_related": false,
      "keys": "external_web_access|type"
    },
    {
      "schema_version": "hibench.benchmark.v1",
      "run_id": "codex-0.113.0-hi",
      "agent_id": "codex",
      "agent_version": "0.113.0",
      "request_index": 1,
      "tool_index": 7,
      "tool_name": "view_image",
      "tool_type": "function",
      "path": "tools.6",
      "definition_chars": 417,
      "definition_tokens": 89,
      "is_mcp_related": false,
      "is_subagent_related": false,
      "keys": "description|name|parameters|strict|type"
    }
  ],
  "mcp": [],
  "subagents": [],
  "skills": [],
  "text_fields": [
    {
      "schema_version": "hibench.benchmark.v1",
      "run_id": "codex-0.113.0-hi",
      "agent_id": "codex",
      "agent_version": "0.113.0",
      "request_index": 1,
      "text_index": 1,
      "category": "system_prompt",
      "source": "main_instructions",
      "role": "",
      "path": "instructions",
      "chars": 12343,
      "tokens": 2551,
      "preview": "You are Codex, a coding agent based on GPT-5. You and the user share the same workspace and collaborate to achieve the u"
    },
    {
      "schema_version": "hibench.benchmark.v1",
      "run_id": "codex-0.113.0-hi",
      "agent_id": "codex",
      "agent_version": "0.113.0",
      "request_index": 1,
      "text_index": 2,
      "category": "system_prompt",
      "source": "permissions_instructions",
      "role": "developer",
      "path": "input.0.content.0.text",
      "chars": 341,
      "tokens": 64,
      "preview": "<permissions instructions>\nFilesystem sandboxing defines which files can be read or written. `sandbox_mode` is `read-onl"
    },
    {
      "schema_version": "hibench.benchmark.v1",
      "run_id": "codex-0.113.0-hi",
      "agent_id": "codex",
      "agent_version": "0.113.0",
      "request_index": 1,
      "text_index": 3,
      "category": "user_prompt",
      "source": "user_prompt",
      "role": "user",
      "path": "input.1.content.0.text",
      "chars": 2972,
      "tokens": 675,
      "preview": "# AGENTS.md instructions for /workspace\n\n<INSTRUCTIONS>\n## Skills\nA skill is a set of local instructions to follow that "
    },
    {
      "schema_version": "hibench.benchmark.v1",
      "run_id": "codex-0.113.0-hi",
      "agent_id": "codex",
      "agent_version": "0.113.0",
      "request_index": 1,
      "text_index": 4,
      "category": "environment_context",
      "source": "injected_user_context",
      "role": "user",
      "path": "input.1.content.1.text",
      "chars": 163,
      "tokens": 50,
      "preview": "<environment_context>\n  <cwd>/workspace</cwd>\n  <shell>bash</shell>\n  <current_date>2026-06-13</current_date>\n  <timezon"
    },
    {
      "schema_version": "hibench.benchmark.v1",
      "run_id": "codex-0.113.0-hi",
      "agent_id": "codex",
      "agent_version": "0.113.0",
      "request_index": 1,
      "text_index": 5,
      "category": "user_prompt",
      "source": "user_prompt",
      "role": "user",
      "path": "input.2.content.0.text",
      "chars": 2,
      "tokens": 1,
      "preview": "Hi"
    }
  ]
}
