{
  "schema_version": "hibench.benchmark.v1",
  "run": {
    "schema_version": "hibench.benchmark.v1",
    "run_id": "claude-code-0.2.25-hi",
    "agent_id": "claude-code",
    "agent_version": "0.2.25",
    "run_dir": "runs/claude-code-0.2.25-hi",
    "agent_name": "Anthropic Claude Code",
    "agent_image": "hibench/claude-code:0.2.25",
    "prompt_file": "prompts/hi.txt",
    "prompt_name": "hi",
    "started_at": "2026-06-13T16:06:37Z",
    "ended_at": "2026-06-13T16:06:38Z",
    "subject_workspace": "generated empty Git repository",
    "real_api_call": false,
    "process_exit_code": 1,
    "process_timed_out": false,
    "request_count": 0,
    "post_request_count": 0,
    "has_primary_request": false,
    "primary_request_index": "",
    "request_method": "",
    "request_path": "",
    "model": "",
    "tokenizer_library": "",
    "tokenizer_encoding": "",
    "total_body_tokens": 0,
    "body_tokens": 0,
    "body_bytes": 0,
    "body_chars": 0,
    "text_field_count": 0,
    "text_tokens": 0,
    "system_prompt_tokens": 0,
    "environment_context_tokens": 0,
    "user_prompt_tokens": 0,
    "assistant_context_tokens": 0,
    "tool_context_tokens": 0,
    "other_text_tokens": 0,
    "main_instructions_tokens": 0,
    "developer_instructions_tokens": 0,
    "permissions_instructions_tokens": 0,
    "skills_instructions_tokens": 0,
    "injected_user_context_tokens": 0,
    "instruction_tokens": 0,
    "default_context_tokens": 0,
    "skills_count": 0,
    "skills_tokens": 0,
    "skill_definition_tokens": 0,
    "tool_count": 0,
    "tool_definition_tokens": 0,
    "mcp_count": 0,
    "mcp_tokens": 0,
    "mcp_marker_count": 0,
    "mcp_mention_count": 0,
    "mcp_mention_tokens": 0,
    "subagent_count": 0,
    "subagent_tokens": 0,
    "subagent_marker_count": 0,
    "subagent_mention_count": 0,
    "subagent_mention_tokens": 0
  },
  "tools": [],
  "mcp": [],
  "subagents": [],
  "skills": [],
  "text_fields": []
}
