{
  "schema_version": "hibench.benchmark.v1",
  "run": {
    "schema_version": "hibench.benchmark.v1",
    "run_id": "opencode-1.14.47-hi",
    "agent_id": "opencode",
    "agent_version": "1.14.47",
    "run_dir": "runs/opencode-1.14.47-hi",
    "agent_name": "OpenCode",
    "agent_image": "hibench/opencode:1.14.47",
    "prompt_file": "prompts/hi.txt",
    "prompt_name": "hi",
    "started_at": "2026-06-13T23:19:12Z",
    "ended_at": "2026-06-13T23:19:14Z",
    "subject_workspace": "generated empty Git repository",
    "real_api_call": false,
    "process_exit_code": 0,
    "process_timed_out": false,
    "request_count": 1,
    "post_request_count": 1,
    "has_primary_request": true,
    "primary_request_index": 1,
    "request_method": "POST",
    "request_path": "/v1/chat/completions",
    "model": "gpt-5",
    "tokenizer_library": "tiktoken",
    "tokenizer_encoding": "o200k_base",
    "total_body_tokens": 9616,
    "body_tokens": 9616,
    "body_bytes": 43607,
    "body_chars": 43589,
    "text_field_count": 2,
    "text_tokens": 1966,
    "system_prompt_tokens": 1965,
    "environment_context_tokens": 0,
    "user_prompt_tokens": 1,
    "assistant_context_tokens": 0,
    "tool_context_tokens": 0,
    "other_text_tokens": 0,
    "main_instructions_tokens": 1965,
    "developer_instructions_tokens": 0,
    "permissions_instructions_tokens": 0,
    "skills_instructions_tokens": 0,
    "injected_user_context_tokens": 0,
    "instruction_tokens": 1965,
    "default_context_tokens": 9463,
    "skills_count": 0,
    "skills_tokens": 0,
    "skill_definition_tokens": 0,
    "tool_count": 9,
    "tool_definition_tokens": 7498,
    "mcp_count": 0,
    "mcp_tokens": 0,
    "mcp_marker_count": 0,
    "mcp_mention_count": 0,
    "mcp_mention_tokens": 0,
    "subagent_count": 2,
    "subagent_tokens": 129,
    "subagent_marker_count": 5,
    "subagent_mention_count": 2,
    "subagent_mention_tokens": 43,
    "anthropic_tokenizer_model": "claude-opus-4-8",
    "anthropic_total_body_tokens": 14802
  },
  "tools": [
    {
      "schema_version": "hibench.benchmark.v1",
      "run_id": "opencode-1.14.47-hi",
      "agent_id": "opencode",
      "agent_version": "1.14.47",
      "request_index": 1,
      "tool_index": 1,
      "tool_name": "apply_patch",
      "tool_type": "function",
      "path": "tools.0",
      "definition_chars": 1431,
      "definition_tokens": 360,
      "is_mcp_related": false,
      "is_subagent_related": false,
      "keys": "function|type"
    },
    {
      "schema_version": "hibench.benchmark.v1",
      "run_id": "opencode-1.14.47-hi",
      "agent_id": "opencode",
      "agent_version": "1.14.47",
      "request_index": 1,
      "tool_index": 2,
      "tool_name": "bash",
      "tool_type": "function",
      "path": "tools.1",
      "definition_chars": 10948,
      "definition_tokens": 2491,
      "is_mcp_related": false,
      "is_subagent_related": false,
      "keys": "function|type"
    },
    {
      "schema_version": "hibench.benchmark.v1",
      "run_id": "opencode-1.14.47-hi",
      "agent_id": "opencode",
      "agent_version": "1.14.47",
      "request_index": 1,
      "tool_index": 3,
      "tool_name": "glob",
      "tool_type": "function",
      "path": "tools.2",
      "definition_chars": 1142,
      "definition_tokens": 245,
      "is_mcp_related": false,
      "is_subagent_related": false,
      "keys": "function|type"
    },
    {
      "schema_version": "hibench.benchmark.v1",
      "run_id": "opencode-1.14.47-hi",
      "agent_id": "opencode",
      "agent_version": "1.14.47",
      "request_index": 1,
      "tool_index": 4,
      "tool_name": "grep",
      "tool_type": "function",
      "path": "tools.3",
      "definition_chars": 1215,
      "definition_tokens": 286,
      "is_mcp_related": false,
      "is_subagent_related": false,
      "keys": "function|type"
    },
    {
      "schema_version": "hibench.benchmark.v1",
      "run_id": "opencode-1.14.47-hi",
      "agent_id": "opencode",
      "agent_version": "1.14.47",
      "request_index": 1,
      "tool_index": 5,
      "tool_name": "read",
      "tool_type": "function",
      "path": "tools.4",
      "definition_chars": 1734,
      "definition_tokens": 415,
      "is_mcp_related": false,
      "is_subagent_related": false,
      "keys": "function|type"
    },
    {
      "schema_version": "hibench.benchmark.v1",
      "run_id": "opencode-1.14.47-hi",
      "agent_id": "opencode",
      "agent_version": "1.14.47",
      "request_index": 1,
      "tool_index": 6,
      "tool_name": "skill",
      "tool_type": "function",
      "path": "tools.5",
      "definition_chars": 712,
      "definition_tokens": 150,
      "is_mcp_related": false,
      "is_subagent_related": false,
      "keys": "function|type"
    },
    {
      "schema_version": "hibench.benchmark.v1",
      "run_id": "opencode-1.14.47-hi",
      "agent_id": "opencode",
      "agent_version": "1.14.47",
      "request_index": 1,
      "tool_index": 7,
      "tool_name": "task",
      "tool_type": "function",
      "path": "tools.6",
      "definition_chars": 5335,
      "definition_tokens": 1189,
      "is_mcp_related": false,
      "is_subagent_related": true,
      "keys": "function|type"
    },
    {
      "schema_version": "hibench.benchmark.v1",
      "run_id": "opencode-1.14.47-hi",
      "agent_id": "opencode",
      "agent_version": "1.14.47",
      "request_index": 1,
      "tool_index": 8,
      "tool_name": "todowrite",
      "tool_type": "function",
      "path": "tools.7",
      "definition_chars": 9638,
      "definition_tokens": 2068,
      "is_mcp_related": false,
      "is_subagent_related": false,
      "keys": "function|type"
    },
    {
      "schema_version": "hibench.benchmark.v1",
      "run_id": "opencode-1.14.47-hi",
      "agent_id": "opencode",
      "agent_version": "1.14.47",
      "request_index": 1,
      "tool_index": 9,
      "tool_name": "webfetch",
      "tool_type": "function",
      "path": "tools.8",
      "definition_chars": 1293,
      "definition_tokens": 294,
      "is_mcp_related": false,
      "is_subagent_related": false,
      "keys": "function|type"
    }
  ],
  "mcp": [],
  "subagents": [
    {
      "schema_version": "hibench.benchmark.v1",
      "run_id": "opencode-1.14.47-hi",
      "agent_id": "opencode",
      "agent_version": "1.14.47",
      "request_index": 1,
      "marker_index": 1,
      "marker_name": "explore",
      "source_type": "declaration",
      "is_counted": true,
      "path": "tools.6.function.description.subagent.0",
      "chars": 495,
      "tokens": 101,
      "preview": "- explore: Fast agent specialized for exploring codebases. Use this when you need to quickly find files by patterns (eg."
    },
    {
      "schema_version": "hibench.benchmark.v1",
      "run_id": "opencode-1.14.47-hi",
      "agent_id": "opencode",
      "agent_version": "1.14.47",
      "request_index": 1,
      "marker_index": 2,
      "marker_name": "general",
      "source_type": "declaration",
      "is_counted": true,
      "path": "tools.6.function.description.subagent.1",
      "chars": 160,
      "tokens": 28,
      "preview": "- general: General-purpose agent for researching complex questions and executing multi-step tasks. Use this agent to exe"
    },
    {
      "schema_version": "hibench.benchmark.v1",
      "run_id": "opencode-1.14.47-hi",
      "agent_id": "opencode",
      "agent_version": "1.14.47",
      "request_index": 1,
      "marker_index": 3,
      "marker_name": "subagent_3",
      "source_type": "text_mention",
      "is_counted": false,
      "path": "tools.6.function.parameters.properties.task_id.description",
      "chars": 187,
      "tokens": 40,
      "preview": "This should only be set if you mean to resume a previous task (you can pass a prior task_id and the task will continue t"
    },
    {
      "schema_version": "hibench.benchmark.v1",
      "run_id": "opencode-1.14.47-hi",
      "agent_id": "opencode",
      "agent_version": "1.14.47",
      "request_index": 1,
      "marker_index": 4,
      "marker_name": "subagent_4",
      "source_type": "text_mention",
      "is_counted": false,
      "path": "tools.6.function.parameters.required.2",
      "chars": 13,
      "tokens": 3,
      "preview": "subagent_type"
    }
  ],
  "skills": [],
  "text_fields": [
    {
      "schema_version": "hibench.benchmark.v1",
      "run_id": "opencode-1.14.47-hi",
      "agent_id": "opencode",
      "agent_version": "1.14.47",
      "request_index": 1,
      "text_index": 1,
      "category": "system_prompt",
      "source": "main_instructions",
      "role": "system",
      "path": "messages.0.content",
      "chars": 9768,
      "tokens": 1965,
      "preview": "You are OpenCode, You and the user share the same workspace and collaborate to achieve the user's goals.\n\nYou are a deep"
    },
    {
      "schema_version": "hibench.benchmark.v1",
      "run_id": "opencode-1.14.47-hi",
      "agent_id": "opencode",
      "agent_version": "1.14.47",
      "request_index": 1,
      "text_index": 2,
      "category": "user_prompt",
      "source": "user_prompt",
      "role": "user",
      "path": "messages.1.content",
      "chars": 2,
      "tokens": 1,
      "preview": "Hi"
    }
  ]
}
