{
  "schema_version": "hibench.benchmark.v1",
  "run": {
    "schema_version": "hibench.benchmark.v1",
    "run_id": "mistral-vibe-1.3.4-hi",
    "agent_id": "mistral-vibe",
    "agent_version": "1.3.4",
    "run_dir": "runs/mistral-vibe-1.3.4-hi",
    "agent_name": "Mistral Vibe",
    "agent_image": "hibench/mistral-vibe:1.3.4",
    "prompt_file": "prompts/hi.txt",
    "prompt_name": "hi",
    "started_at": "2026-06-18T19:56:11Z",
    "ended_at": "2026-06-18T19:56:14Z",
    "subject_workspace": "generated empty Git repository",
    "real_api_call": false,
    "process_exit_code": 0,
    "process_timed_out": false,
    "request_count": 1,
    "post_request_count": 1,
    "has_primary_request": true,
    "primary_request_index": 1,
    "request_method": "POST",
    "request_path": "/v1/chat/completions",
    "model": "gpt-5",
    "tokenizer_library": "tiktoken",
    "tokenizer_encoding": "o200k_base",
    "total_body_tokens": 4871,
    "body_tokens": 4871,
    "body_bytes": 18610,
    "body_chars": 18610,
    "text_field_count": 2,
    "text_tokens": 3500,
    "system_prompt_tokens": 3499,
    "environment_context_tokens": 0,
    "user_prompt_tokens": 1,
    "assistant_context_tokens": 0,
    "tool_context_tokens": 0,
    "other_text_tokens": 0,
    "main_instructions_tokens": 3499,
    "developer_instructions_tokens": 0,
    "permissions_instructions_tokens": 0,
    "skills_instructions_tokens": 0,
    "injected_user_context_tokens": 0,
    "instruction_tokens": 3499,
    "default_context_tokens": 4215,
    "skills_count": 0,
    "skills_tokens": 0,
    "skill_definition_tokens": 0,
    "tool_count": 6,
    "tool_definition_tokens": 716,
    "mcp_count": 0,
    "mcp_tokens": 0,
    "mcp_marker_count": 0,
    "mcp_mention_count": 0,
    "mcp_mention_tokens": 0,
    "subagent_count": 0,
    "subagent_tokens": 0,
    "subagent_marker_count": 0,
    "subagent_mention_count": 0,
    "subagent_mention_tokens": 0,
    "anthropic_tokenizer_model": "claude-opus-4-8",
    "anthropic_total_body_tokens": 7596
  },
  "tools": [
    {
      "schema_version": "hibench.benchmark.v1",
      "run_id": "mistral-vibe-1.3.4-hi",
      "agent_id": "mistral-vibe",
      "agent_version": "1.3.4",
      "request_index": 1,
      "tool_index": 1,
      "tool_name": "write_file",
      "tool_type": "function",
      "path": "tools.0",
      "definition_chars": 391,
      "definition_tokens": 88,
      "is_mcp_related": false,
      "is_subagent_related": false,
      "keys": "function|type"
    },
    {
      "schema_version": "hibench.benchmark.v1",
      "run_id": "mistral-vibe-1.3.4-hi",
      "agent_id": "mistral-vibe",
      "agent_version": "1.3.4",
      "request_index": 1,
      "tool_index": 2,
      "tool_name": "read_file",
      "tool_type": "function",
      "path": "tools.1",
      "definition_chars": 502,
      "definition_tokens": 116,
      "is_mcp_related": false,
      "is_subagent_related": false,
      "keys": "function|type"
    },
    {
      "schema_version": "hibench.benchmark.v1",
      "run_id": "mistral-vibe-1.3.4-hi",
      "agent_id": "mistral-vibe",
      "agent_version": "1.3.4",
      "request_index": 1,
      "tool_index": 3,
      "tool_name": "search_replace",
      "tool_type": "function",
      "path": "tools.2",
      "definition_chars": 396,
      "definition_tokens": 87,
      "is_mcp_related": false,
      "is_subagent_related": false,
      "keys": "function|type"
    },
    {
      "schema_version": "hibench.benchmark.v1",
      "run_id": "mistral-vibe-1.3.4-hi",
      "agent_id": "mistral-vibe",
      "agent_version": "1.3.4",
      "request_index": 1,
      "tool_index": 4,
      "tool_name": "bash",
      "tool_type": "function",
      "path": "tools.3",
      "definition_chars": 336,
      "definition_tokens": 74,
      "is_mcp_related": false,
      "is_subagent_related": false,
      "keys": "function|type"
    },
    {
      "schema_version": "hibench.benchmark.v1",
      "run_id": "mistral-vibe-1.3.4-hi",
      "agent_id": "mistral-vibe",
      "agent_version": "1.3.4",
      "request_index": 1,
      "tool_index": 5,
      "tool_name": "grep",
      "tool_type": "function",
      "path": "tools.4",
      "definition_chars": 604,
      "definition_tokens": 136,
      "is_mcp_related": false,
      "is_subagent_related": false,
      "keys": "function|type"
    },
    {
      "schema_version": "hibench.benchmark.v1",
      "run_id": "mistral-vibe-1.3.4-hi",
      "agent_id": "mistral-vibe",
      "agent_version": "1.3.4",
      "request_index": 1,
      "tool_index": 6,
      "tool_name": "todo",
      "tool_type": "function",
      "path": "tools.5",
      "definition_chars": 847,
      "definition_tokens": 215,
      "is_mcp_related": false,
      "is_subagent_related": false,
      "keys": "function|type"
    }
  ],
  "mcp": [],
  "subagents": [],
  "skills": [],
  "text_fields": [
    {
      "schema_version": "hibench.benchmark.v1",
      "run_id": "mistral-vibe-1.3.4-hi",
      "agent_id": "mistral-vibe",
      "agent_version": "1.3.4",
      "request_index": 1,
      "text_index": 1,
      "category": "system_prompt",
      "source": "main_instructions",
      "role": "system",
      "path": "messages.0.content",
      "chars": 14291,
      "tokens": 3499,
      "preview": "You are operating as and within Mistral Vibe, a CLI coding-agent built by Mistral AI and powered by default by the Devst"
    },
    {
      "schema_version": "hibench.benchmark.v1",
      "run_id": "mistral-vibe-1.3.4-hi",
      "agent_id": "mistral-vibe",
      "agent_version": "1.3.4",
      "request_index": 1,
      "text_index": 2,
      "category": "user_prompt",
      "source": "user_prompt",
      "role": "user",
      "path": "messages.1.content",
      "chars": 2,
      "tokens": 1,
      "preview": "Hi"
    }
  ]
}
