{
  "schema_version": "hibench.benchmark.v1",
  "run": {
    "schema_version": "hibench.benchmark.v1",
    "run_id": "mistral-vibe-2.7.5-hi",
    "agent_id": "mistral-vibe",
    "agent_version": "2.7.5",
    "run_dir": "runs/mistral-vibe-2.7.5-hi",
    "agent_name": "Mistral Vibe",
    "agent_image": "hibench/mistral-vibe:2.7.5",
    "prompt_file": "prompts/hi.txt",
    "prompt_name": "hi",
    "started_at": "2026-06-18T20:04:11Z",
    "ended_at": "2026-06-18T20:04:16Z",
    "subject_workspace": "generated empty Git repository",
    "real_api_call": false,
    "process_exit_code": 0,
    "process_timed_out": false,
    "request_count": 1,
    "post_request_count": 1,
    "has_primary_request": true,
    "primary_request_index": 1,
    "request_method": "POST",
    "request_path": "/v1/chat/completions",
    "model": "gpt-5",
    "tokenizer_library": "tiktoken",
    "tokenizer_encoding": "o200k_base",
    "total_body_tokens": 7054,
    "body_tokens": 7054,
    "body_bytes": 28213,
    "body_chars": 28118,
    "text_field_count": 2,
    "text_tokens": 5229,
    "system_prompt_tokens": 5228,
    "environment_context_tokens": 0,
    "user_prompt_tokens": 1,
    "assistant_context_tokens": 0,
    "tool_context_tokens": 0,
    "other_text_tokens": 0,
    "main_instructions_tokens": 5228,
    "developer_instructions_tokens": 0,
    "permissions_instructions_tokens": 0,
    "skills_instructions_tokens": 0,
    "injected_user_context_tokens": 0,
    "instruction_tokens": 5228,
    "default_context_tokens": 6261,
    "skills_count": 0,
    "skills_tokens": 0,
    "skill_definition_tokens": 0,
    "tool_count": 9,
    "tool_definition_tokens": 1033,
    "mcp_count": 0,
    "mcp_tokens": 0,
    "mcp_marker_count": 0,
    "mcp_mention_count": 0,
    "mcp_mention_tokens": 0,
    "subagent_count": 1,
    "subagent_tokens": 14,
    "subagent_marker_count": 5,
    "subagent_mention_count": 3,
    "subagent_mention_tokens": 59,
    "anthropic_tokenizer_model": "claude-opus-4-8",
    "anthropic_total_body_tokens": 11068
  },
  "tools": [
    {
      "schema_version": "hibench.benchmark.v1",
      "run_id": "mistral-vibe-2.7.5-hi",
      "agent_id": "mistral-vibe",
      "agent_version": "2.7.5",
      "request_index": 1,
      "tool_index": 1,
      "tool_name": "write_file",
      "tool_type": "function",
      "path": "tools.0",
      "definition_chars": 391,
      "definition_tokens": 88,
      "is_mcp_related": false,
      "is_subagent_related": false,
      "keys": "function|type"
    },
    {
      "schema_version": "hibench.benchmark.v1",
      "run_id": "mistral-vibe-2.7.5-hi",
      "agent_id": "mistral-vibe",
      "agent_version": "2.7.5",
      "request_index": 1,
      "tool_index": 2,
      "tool_name": "read_file",
      "tool_type": "function",
      "path": "tools.1",
      "definition_chars": 528,
      "definition_tokens": 118,
      "is_mcp_related": false,
      "is_subagent_related": false,
      "keys": "function|type"
    },
    {
      "schema_version": "hibench.benchmark.v1",
      "run_id": "mistral-vibe-2.7.5-hi",
      "agent_id": "mistral-vibe",
      "agent_version": "2.7.5",
      "request_index": 1,
      "tool_index": 3,
      "tool_name": "task",
      "tool_type": "function",
      "path": "tools.2",
      "definition_chars": 525,
      "definition_tokens": 111,
      "is_mcp_related": false,
      "is_subagent_related": true,
      "keys": "function|type"
    },
    {
      "schema_version": "hibench.benchmark.v1",
      "run_id": "mistral-vibe-2.7.5-hi",
      "agent_id": "mistral-vibe",
      "agent_version": "2.7.5",
      "request_index": 1,
      "tool_index": 4,
      "tool_name": "web_fetch",
      "tool_type": "function",
      "path": "tools.3",
      "definition_chars": 384,
      "definition_tokens": 90,
      "is_mcp_related": false,
      "is_subagent_related": false,
      "keys": "function|type"
    },
    {
      "schema_version": "hibench.benchmark.v1",
      "run_id": "mistral-vibe-2.7.5-hi",
      "agent_id": "mistral-vibe",
      "agent_version": "2.7.5",
      "request_index": 1,
      "tool_index": 5,
      "tool_name": "search_replace",
      "tool_type": "function",
      "path": "tools.4",
      "definition_chars": 396,
      "definition_tokens": 87,
      "is_mcp_related": false,
      "is_subagent_related": false,
      "keys": "function|type"
    },
    {
      "schema_version": "hibench.benchmark.v1",
      "run_id": "mistral-vibe-2.7.5-hi",
      "agent_id": "mistral-vibe",
      "agent_version": "2.7.5",
      "request_index": 1,
      "tool_index": 6,
      "tool_name": "bash",
      "tool_type": "function",
      "path": "tools.5",
      "definition_chars": 336,
      "definition_tokens": 74,
      "is_mcp_related": false,
      "is_subagent_related": false,
      "keys": "function|type"
    },
    {
      "schema_version": "hibench.benchmark.v1",
      "run_id": "mistral-vibe-2.7.5-hi",
      "agent_id": "mistral-vibe",
      "agent_version": "2.7.5",
      "request_index": 1,
      "tool_index": 7,
      "tool_name": "grep",
      "tool_type": "function",
      "path": "tools.6",
      "definition_chars": 604,
      "definition_tokens": 136,
      "is_mcp_related": false,
      "is_subagent_related": false,
      "keys": "function|type"
    },
    {
      "schema_version": "hibench.benchmark.v1",
      "run_id": "mistral-vibe-2.7.5-hi",
      "agent_id": "mistral-vibe",
      "agent_version": "2.7.5",
      "request_index": 1,
      "tool_index": 8,
      "tool_name": "skill",
      "tool_type": "function",
      "path": "tools.7",
      "definition_chars": 605,
      "definition_tokens": 114,
      "is_mcp_related": false,
      "is_subagent_related": false,
      "keys": "function|type"
    },
    {
      "schema_version": "hibench.benchmark.v1",
      "run_id": "mistral-vibe-2.7.5-hi",
      "agent_id": "mistral-vibe",
      "agent_version": "2.7.5",
      "request_index": 1,
      "tool_index": 9,
      "tool_name": "todo",
      "tool_type": "function",
      "path": "tools.8",
      "definition_chars": 847,
      "definition_tokens": 215,
      "is_mcp_related": false,
      "is_subagent_related": false,
      "keys": "function|type"
    }
  ],
  "mcp": [],
  "subagents": [
    {
      "schema_version": "hibench.benchmark.v1",
      "run_id": "mistral-vibe-2.7.5-hi",
      "agent_id": "mistral-vibe",
      "agent_version": "2.7.5",
      "request_index": 1,
      "marker_index": 1,
      "marker_name": "explore",
      "source_type": "declaration",
      "is_counted": true,
      "path": "messages.0.content.subagent.0",
      "chars": 58,
      "tokens": 14,
      "preview": "- **explore**: Read-only subagent for codebase exploration"
    },
    {
      "schema_version": "hibench.benchmark.v1",
      "run_id": "mistral-vibe-2.7.5-hi",
      "agent_id": "mistral-vibe",
      "agent_version": "2.7.5",
      "request_index": 1,
      "marker_index": 2,
      "marker_name": "subagent_2",
      "source_type": "text_mention",
      "is_counted": false,
      "path": "tools.2.function.description",
      "chars": 202,
      "tokens": 37,
      "preview": "Delegate a task to a subagent for independent execution. Useful for exploration, research, or parallel work that doesn't"
    },
    {
      "schema_version": "hibench.benchmark.v1",
      "run_id": "mistral-vibe-2.7.5-hi",
      "agent_id": "mistral-vibe",
      "agent_version": "2.7.5",
      "request_index": 1,
      "marker_index": 3,
      "marker_name": "subagent_3",
      "source_type": "text_mention",
      "is_counted": false,
      "path": "tools.2.function.parameters.properties.task.description",
      "chars": 36,
      "tokens": 8,
      "preview": "The task to delegate to the subagent"
    },
    {
      "schema_version": "hibench.benchmark.v1",
      "run_id": "mistral-vibe-2.7.5-hi",
      "agent_id": "mistral-vibe",
      "agent_version": "2.7.5",
      "request_index": 1,
      "marker_index": 4,
      "marker_name": "subagent_4",
      "source_type": "text_mention",
      "is_counted": false,
      "path": "tools.2.function.parameters.properties.agent.description",
      "chars": 53,
      "tokens": 14,
      "preview": "Name of the agent profile to use (must be a subagent)"
    }
  ],
  "skills": [],
  "text_fields": [
    {
      "schema_version": "hibench.benchmark.v1",
      "run_id": "mistral-vibe-2.7.5-hi",
      "agent_id": "mistral-vibe",
      "agent_version": "2.7.5",
      "request_index": 1,
      "text_index": 1,
      "category": "system_prompt",
      "source": "main_instructions",
      "role": "system",
      "path": "messages.0.content",
      "chars": 22048,
      "tokens": 5228,
      "preview": "You are Mistral Vibe, a CLI coding agent built by Mistral AI. You interact with a local codebase through tools.\nCRITICAL"
    },
    {
      "schema_version": "hibench.benchmark.v1",
      "run_id": "mistral-vibe-2.7.5-hi",
      "agent_id": "mistral-vibe",
      "agent_version": "2.7.5",
      "request_index": 1,
      "text_index": 2,
      "category": "user_prompt",
      "source": "user_prompt",
      "role": "user",
      "path": "messages.1.content",
      "chars": 2,
      "tokens": 1,
      "preview": "Hi"
    }
  ]
}
