{
  "schema_version": "hibench.benchmark.v1",
  "run": {
    "schema_version": "hibench.benchmark.v1",
    "run_id": "gemini-cli-0.19.4-hi",
    "agent_id": "gemini-cli",
    "agent_version": "0.19.4",
    "run_dir": "runs/gemini-cli-0.19.4-hi",
    "agent_name": "Gemini CLI",
    "agent_image": "hibench/gemini-cli:0.19.4",
    "prompt_file": "prompts/hi.txt",
    "prompt_name": "hi",
    "started_at": "2026-06-22T18:19:05Z",
    "ended_at": "2026-06-22T18:19:09Z",
    "subject_workspace": "generated empty Git repository",
    "real_api_call": false,
    "process_exit_code": 0,
    "process_timed_out": false,
    "request_count": 1,
    "post_request_count": 1,
    "has_primary_request": true,
    "primary_request_index": 1,
    "request_method": "POST",
    "request_path": "/v1beta/models/gemini-2.5-flash:streamGenerateContent?alt=sse",
    "model": "gemini-2.5-flash",
    "tokenizer_library": "tiktoken",
    "tokenizer_encoding": "o200k_base",
    "anthropic_tokenizer_model": "claude-opus-4-8",
    "anthropic_total_body_tokens": 10572,
    "total_body_tokens": 6719,
    "body_tokens": 6719,
    "body_bytes": 31398,
    "body_chars": 31390,
    "text_field_count": 3,
    "text_tokens": 3456,
    "system_prompt_tokens": 3264,
    "environment_context_tokens": 191,
    "user_prompt_tokens": 1,
    "assistant_context_tokens": 0,
    "tool_context_tokens": 0,
    "other_text_tokens": 0,
    "main_instructions_tokens": 3264,
    "developer_instructions_tokens": 0,
    "permissions_instructions_tokens": 0,
    "skills_instructions_tokens": 0,
    "injected_user_context_tokens": 191,
    "instruction_tokens": 3455,
    "default_context_tokens": 6559,
    "skills_count": 0,
    "skills_tokens": 0,
    "skill_definition_tokens": 0,
    "tool_count": 9,
    "tool_definition_tokens": 3104,
    "mcp_count": 0,
    "mcp_tokens": 0,
    "mcp_marker_count": 0,
    "mcp_mention_count": 0,
    "mcp_mention_tokens": 0,
    "subagent_count": 0,
    "subagent_tokens": 0,
    "subagent_marker_count": 0,
    "subagent_mention_count": 0,
    "subagent_mention_tokens": 0
  },
  "tools": [
    {
      "schema_version": "hibench.benchmark.v1",
      "run_id": "gemini-cli-0.19.4-hi",
      "agent_id": "gemini-cli",
      "agent_version": "0.19.4",
      "request_index": 1,
      "tool_index": 1,
      "tool_name": "list_directory",
      "tool_type": "function",
      "path": "tools.0",
      "definition_chars": 949,
      "definition_tokens": 190,
      "is_mcp_related": false,
      "is_subagent_related": false,
      "keys": "description|name|parametersJsonSchema|type"
    },
    {
      "schema_version": "hibench.benchmark.v1",
      "run_id": "gemini-cli-0.19.4-hi",
      "agent_id": "gemini-cli",
      "agent_version": "0.19.4",
      "request_index": 1,
      "tool_index": 2,
      "tool_name": "read_file",
      "tool_type": "function",
      "path": "tools.1",
      "definition_chars": 1011,
      "definition_tokens": 230,
      "is_mcp_related": false,
      "is_subagent_related": false,
      "keys": "description|name|parametersJsonSchema|type"
    },
    {
      "schema_version": "hibench.benchmark.v1",
      "run_id": "gemini-cli-0.19.4-hi",
      "agent_id": "gemini-cli",
      "agent_version": "0.19.4",
      "request_index": 1,
      "tool_index": 3,
      "tool_name": "search_file_content",
      "tool_type": "function",
      "path": "tools.2",
      "definition_chars": 1830,
      "definition_tokens": 397,
      "is_mcp_related": false,
      "is_subagent_related": false,
      "keys": "description|name|parametersJsonSchema|type"
    },
    {
      "schema_version": "hibench.benchmark.v1",
      "run_id": "gemini-cli-0.19.4-hi",
      "agent_id": "gemini-cli",
      "agent_version": "0.19.4",
      "request_index": 1,
      "tool_index": 4,
      "tool_name": "glob",
      "tool_type": "function",
      "path": "tools.3",
      "definition_chars": 1103,
      "definition_tokens": 230,
      "is_mcp_related": false,
      "is_subagent_related": false,
      "keys": "description|name|parametersJsonSchema|type"
    },
    {
      "schema_version": "hibench.benchmark.v1",
      "run_id": "gemini-cli-0.19.4-hi",
      "agent_id": "gemini-cli",
      "agent_version": "0.19.4",
      "request_index": 1,
      "tool_index": 5,
      "tool_name": "web_fetch",
      "tool_type": "function",
      "path": "tools.4",
      "definition_chars": 911,
      "definition_tokens": 205,
      "is_mcp_related": false,
      "is_subagent_related": false,
      "keys": "description|name|parametersJsonSchema|type"
    },
    {
      "schema_version": "hibench.benchmark.v1",
      "run_id": "gemini-cli-0.19.4-hi",
      "agent_id": "gemini-cli",
      "agent_version": "0.19.4",
      "request_index": 1,
      "tool_index": 6,
      "tool_name": "save_memory",
      "tool_type": "function",
      "path": "tools.5",
      "definition_chars": 1391,
      "definition_tokens": 306,
      "is_mcp_related": false,
      "is_subagent_related": false,
      "keys": "description|name|parametersJsonSchema|type"
    },
    {
      "schema_version": "hibench.benchmark.v1",
      "run_id": "gemini-cli-0.19.4-hi",
      "agent_id": "gemini-cli",
      "agent_version": "0.19.4",
      "request_index": 1,
      "tool_index": 7,
      "tool_name": "google_web_search",
      "tool_type": "function",
      "path": "tools.6",
      "definition_chars": 396,
      "definition_tokens": 82,
      "is_mcp_related": false,
      "is_subagent_related": false,
      "keys": "description|name|parametersJsonSchema|type"
    },
    {
      "schema_version": "hibench.benchmark.v1",
      "run_id": "gemini-cli-0.19.4-hi",
      "agent_id": "gemini-cli",
      "agent_version": "0.19.4",
      "request_index": 1,
      "tool_index": 8,
      "tool_name": "write_todos",
      "tool_type": "function",
      "path": "tools.7",
      "definition_chars": 5878,
      "definition_tokens": 1316,
      "is_mcp_related": false,
      "is_subagent_related": false,
      "keys": "description|name|parametersJsonSchema|responseJsonSchema|type"
    },
    {
      "schema_version": "hibench.benchmark.v1",
      "run_id": "gemini-cli-0.19.4-hi",
      "agent_id": "gemini-cli",
      "agent_version": "0.19.4",
      "request_index": 1,
      "tool_index": 9,
      "tool_name": "codebase_investigator",
      "tool_type": "function",
      "path": "tools.8",
      "definition_chars": 812,
      "definition_tokens": 148,
      "is_mcp_related": false,
      "is_subagent_related": false,
      "keys": "description|name|parametersJsonSchema|type"
    }
  ],
  "mcp": [],
  "subagents": [],
  "skills": [],
  "text_fields": [
    {
      "schema_version": "hibench.benchmark.v1",
      "run_id": "gemini-cli-0.19.4-hi",
      "agent_id": "gemini-cli",
      "agent_version": "0.19.4",
      "request_index": 1,
      "text_index": 1,
      "category": "environment_context",
      "source": "injected_user_context",
      "role": "user",
      "path": "contents.0.parts.0.text",
      "chars": 770,
      "tokens": 191,
      "preview": "This is the Gemini CLI. We are setting up the context for our chat.\nToday's date is Monday, June 22, 2026 (formatted acc"
    },
    {
      "schema_version": "hibench.benchmark.v1",
      "run_id": "gemini-cli-0.19.4-hi",
      "agent_id": "gemini-cli",
      "agent_version": "0.19.4",
      "request_index": 1,
      "text_index": 2,
      "category": "user_prompt",
      "source": "user_prompt",
      "role": "user",
      "path": "contents.1.parts.0.text",
      "chars": 2,
      "tokens": 1,
      "preview": "Hi"
    },
    {
      "schema_version": "hibench.benchmark.v1",
      "run_id": "gemini-cli-0.19.4-hi",
      "agent_id": "gemini-cli",
      "agent_version": "0.19.4",
      "request_index": 1,
      "text_index": 3,
      "category": "system_prompt",
      "source": "main_instructions",
      "role": "user",
      "path": "systemInstruction.parts.0.text",
      "chars": 16051,
      "tokens": 3264,
      "preview": "You are an interactive CLI agent specializing in software engineering tasks. Your primary goal is to help users safely a"
    }
  ]
}
