{
  "schema_version": "hibench.benchmark.v1",
  "run": {
    "schema_version": "hibench.benchmark.v1",
    "run_id": "droid-0.122.0-hi",
    "agent_id": "droid",
    "agent_version": "0.122.0",
    "run_dir": "runs/droid-0.122.0-hi",
    "agent_name": "Droid",
    "agent_image": "hibench/droid:0.122.0",
    "prompt_file": "prompts/hi.txt",
    "prompt_name": "hi",
    "started_at": "2026-06-20T22:52:50Z",
    "ended_at": "2026-06-20T22:52:53Z",
    "subject_workspace": "generated empty Git repository",
    "real_api_call": false,
    "process_exit_code": 0,
    "process_timed_out": false,
    "request_count": 1,
    "post_request_count": 1,
    "has_primary_request": true,
    "primary_request_index": 1,
    "request_method": "POST",
    "request_path": "/v1/responses",
    "model": "gpt-5",
    "tokenizer_library": "tiktoken",
    "tokenizer_encoding": "o200k_base",
    "anthropic_tokenizer_model": "claude-opus-4-8",
    "anthropic_total_body_tokens": 19387,
    "total_body_tokens": 12104,
    "body_tokens": 12104,
    "body_bytes": 51685,
    "body_chars": 51593,
    "text_field_count": 4,
    "text_tokens": 1328,
    "system_prompt_tokens": 1038,
    "environment_context_tokens": 289,
    "user_prompt_tokens": 1,
    "assistant_context_tokens": 0,
    "tool_context_tokens": 0,
    "other_text_tokens": 0,
    "main_instructions_tokens": 958,
    "developer_instructions_tokens": 80,
    "permissions_instructions_tokens": 0,
    "skills_instructions_tokens": 0,
    "injected_user_context_tokens": 289,
    "instruction_tokens": 1327,
    "default_context_tokens": 11916,
    "skills_count": 0,
    "skills_tokens": 0,
    "skill_definition_tokens": 0,
    "tool_count": 9,
    "tool_definition_tokens": 10589,
    "mcp_count": 0,
    "mcp_tokens": 0,
    "mcp_marker_count": 1,
    "mcp_mention_count": 1,
    "mcp_mention_tokens": 1009,
    "subagent_count": 0,
    "subagent_tokens": 0,
    "subagent_marker_count": 0,
    "subagent_mention_count": 0,
    "subagent_mention_tokens": 0
  },
  "tools": [
    {
      "schema_version": "hibench.benchmark.v1",
      "run_id": "droid-0.122.0-hi",
      "agent_id": "droid",
      "agent_version": "0.122.0",
      "request_index": 1,
      "tool_index": 1,
      "tool_name": "Read",
      "tool_type": "function",
      "path": "tools.0",
      "definition_chars": 1351,
      "definition_tokens": 309,
      "is_mcp_related": false,
      "is_subagent_related": false,
      "keys": "description|name|parameters|strict|type"
    },
    {
      "schema_version": "hibench.benchmark.v1",
      "run_id": "droid-0.122.0-hi",
      "agent_id": "droid",
      "agent_version": "0.122.0",
      "request_index": 1,
      "tool_index": 2,
      "tool_name": "LS",
      "tool_type": "function",
      "path": "tools.1",
      "definition_chars": 834,
      "definition_tokens": 176,
      "is_mcp_related": false,
      "is_subagent_related": false,
      "keys": "description|name|parameters|strict|type"
    },
    {
      "schema_version": "hibench.benchmark.v1",
      "run_id": "droid-0.122.0-hi",
      "agent_id": "droid",
      "agent_version": "0.122.0",
      "request_index": 1,
      "tool_index": 3,
      "tool_name": "Execute",
      "tool_type": "function",
      "path": "tools.2",
      "definition_chars": 17260,
      "definition_tokens": 4147,
      "is_mcp_related": false,
      "is_subagent_related": false,
      "keys": "description|name|parameters|strict|type"
    },
    {
      "schema_version": "hibench.benchmark.v1",
      "run_id": "droid-0.122.0-hi",
      "agent_id": "droid",
      "agent_version": "0.122.0",
      "request_index": 1,
      "tool_index": 4,
      "tool_name": "Grep",
      "tool_type": "function",
      "path": "tools.3",
      "definition_chars": 3305,
      "definition_tokens": 738,
      "is_mcp_related": false,
      "is_subagent_related": false,
      "keys": "description|name|parameters|strict|type"
    },
    {
      "schema_version": "hibench.benchmark.v1",
      "run_id": "droid-0.122.0-hi",
      "agent_id": "droid",
      "agent_version": "0.122.0",
      "request_index": 1,
      "tool_index": 5,
      "tool_name": "Glob",
      "tool_type": "function",
      "path": "tools.4",
      "definition_chars": 1949,
      "definition_tokens": 435,
      "is_mcp_related": false,
      "is_subagent_related": false,
      "keys": "description|name|parameters|strict|type"
    },
    {
      "schema_version": "hibench.benchmark.v1",
      "run_id": "droid-0.122.0-hi",
      "agent_id": "droid",
      "agent_version": "0.122.0",
      "request_index": 1,
      "tool_index": 6,
      "tool_name": "WebSearch",
      "tool_type": "function",
      "path": "tools.5",
      "definition_chars": 2501,
      "definition_tokens": 545,
      "is_mcp_related": false,
      "is_subagent_related": false,
      "keys": "description|name|parameters|strict|type"
    },
    {
      "schema_version": "hibench.benchmark.v1",
      "run_id": "droid-0.122.0-hi",
      "agent_id": "droid",
      "agent_version": "0.122.0",
      "request_index": 1,
      "tool_index": 7,
      "tool_name": "TodoWrite",
      "tool_type": "function",
      "path": "tools.6",
      "definition_chars": 9510,
      "definition_tokens": 2248,
      "is_mcp_related": false,
      "is_subagent_related": false,
      "keys": "description|name|parameters|strict|type"
    },
    {
      "schema_version": "hibench.benchmark.v1",
      "run_id": "droid-0.122.0-hi",
      "agent_id": "droid",
      "agent_version": "0.122.0",
      "request_index": 1,
      "tool_index": 8,
      "tool_name": "FetchUrl",
      "tool_type": "function",
      "path": "tools.7",
      "definition_chars": 3124,
      "definition_tokens": 847,
      "is_mcp_related": false,
      "is_subagent_related": false,
      "keys": "description|name|parameters|strict|type"
    },
    {
      "schema_version": "hibench.benchmark.v1",
      "run_id": "droid-0.122.0-hi",
      "agent_id": "droid",
      "agent_version": "0.122.0",
      "request_index": 1,
      "tool_index": 9,
      "tool_name": "Skill",
      "tool_type": "function",
      "path": "tools.8",
      "definition_chars": 4957,
      "definition_tokens": 1144,
      "is_mcp_related": true,
      "is_subagent_related": false,
      "keys": "description|name|parameters|strict|type"
    }
  ],
  "mcp": [
    {
      "schema_version": "hibench.benchmark.v1",
      "run_id": "droid-0.122.0-hi",
      "agent_id": "droid",
      "agent_version": "0.122.0",
      "request_index": 1,
      "marker_index": 1,
      "marker_name": "mcp_1",
      "source_type": "text_mention",
      "is_counted": false,
      "path": "tools.8.description",
      "chars": 4589,
      "tokens": 1009,
      "preview": "Execute a skill within the main conversation\n\n<skills_instructions>\nWhen users ask you to perform tasks, check if any of"
    }
  ],
  "subagents": [],
  "skills": [],
  "text_fields": [
    {
      "schema_version": "hibench.benchmark.v1",
      "run_id": "droid-0.122.0-hi",
      "agent_id": "droid",
      "agent_version": "0.122.0",
      "request_index": 1,
      "text_index": 1,
      "category": "environment_context",
      "source": "injected_user_context",
      "role": "user",
      "path": "input.0.content.0.text",
      "chars": 1249,
      "tokens": 289,
      "preview": "<system-reminder>\n\nUser system info (linux 6.6.87.2-microsoft-standard-WSL2)\nShell: bash inside WSL2 — real Linux on a W"
    },
    {
      "schema_version": "hibench.benchmark.v1",
      "run_id": "droid-0.122.0-hi",
      "agent_id": "droid",
      "agent_version": "0.122.0",
      "request_index": 1,
      "text_index": 2,
      "category": "system_prompt",
      "source": "developer_instructions",
      "role": "user",
      "path": "input.0.content.1.text",
      "chars": 376,
      "tokens": 80,
      "preview": "<system-reminder>IMPORTANT: TodoWrite was not called yet. You must call it for any non-trivial task requested by the use"
    },
    {
      "schema_version": "hibench.benchmark.v1",
      "run_id": "droid-0.122.0-hi",
      "agent_id": "droid",
      "agent_version": "0.122.0",
      "request_index": 1,
      "text_index": 3,
      "category": "user_prompt",
      "source": "user_prompt",
      "role": "user",
      "path": "input.1.content.0.text",
      "chars": 2,
      "tokens": 1,
      "preview": "Hi"
    },
    {
      "schema_version": "hibench.benchmark.v1",
      "run_id": "droid-0.122.0-hi",
      "agent_id": "droid",
      "agent_version": "0.122.0",
      "request_index": 1,
      "text_index": 4,
      "category": "system_prompt",
      "source": "main_instructions",
      "role": "",
      "path": "instructions",
      "chars": 4687,
      "tokens": 958,
      "preview": "You are Droid, an AI software engineering agent built by Factory.\n\nYou are running in non-interactive Exec Mode where yo"
    }
  ]
}
